{
  "id": "entity_context_pack",
  "name": "Context Pack",
  "status": "draft",
  "domain": "Context Pack",
  "ownerService": "service_brand_knowledge",
  "fields": [
    "id",
    "workspaceId",
    "name",
    "status",
    "taskType",
    "includedClaims",
    "includedDecisions",
    "expiresAt"
  ],
  "relationships": [
    "belongs to Workspace",
    "references Brand Profile",
    "references Claims",
    "references Decisions",
    "reviewed by Review"
  ],
  "retention": "Retain approved versions until deprecated by decision record or workspace archival policy."
}
